{
  "$schema": "../../../schemas/map.schema.json",
  "id": "biblio-coin-douillet",
  "name": "Bibliothèque : le coin douillet",
  "background": "assets/backgrounds/biblio-coin-douillet.jpg",
  "setFlags": ["coin-douillet-vu"],
  "triggers": [
    {
      "dialogue": "arrivee"
    }
  ],
  "regions": [
    {
      "id": "bocal",
      "label": "Un bocal vide",
      "if": ["mission-ingredients"],
      "ifNot": ["bocal-pris"],
      "shape": {
        "type": "rect",
        "x": 83.3,
        "y": 63.8,
        "width": 4.1,
        "height": 16.3
      },
      "action": {
        "type": "dialogue",
        "dialogue": "bocal"
      }
    },
    {
      "id": "glycine",
      "label": "Essence de glycine concentrée",
      "if": ["mission-ingredients"],
      "ifNot": ["glycine-prise"],
      "shape": {
        "type": "rect",
        "x": 49.5,
        "y": 47.5,
        "width": 6,
        "height": 11
      },
      "action": {
        "type": "dialogue",
        "dialogue": "glycine"
      }
    },
    {
      "id": "retour",
      "label": "Retour dans la bibliothèque",
      "shape": {
        "type": "rect",
        "x": 30,
        "y": 88,
        "width": 40,
        "height": 12
      },
      "action": {
        "type": "goto",
        "map": "bibliotheque"
      },
      "arrow": "down"
    }
  ],
  "dialogues": {
    "arrivee": {
      "lines": [
        {
          "text": "« Les étagères sont remplies de livres de recettes et d'ingrédients divers pour la préparation de potions. »"
        }
      ]
    },
    "bocal": {
      "setFlags": ["bocal-pris"],
      "lines": [
        {
          "text": "Un bocal vide."
        },
        {
          "character": "joueur",
          "text": "« Ça me sera utile pour transporter la terre. »"
        }
      ]
    },
    "glycine": {
      "setFlags": ["glycine-prise"],
      "lines": [
        {
          "text": "Je prends une fiole d'essence de glycine concentrée."
        }
      ]
    }
  }
}
