{
  "$schema": "../../../schemas/map.schema.json",
  "id": "logement",
  "name": "Mon logement",
  "backgroundColor": "#2a2140",
  "regions": [
    {
      "id": "affaires",
      "label": "Mes affaires",
      "button": "Mes affaires",
      "shape": {
        "type": "rect",
        "x": 10,
        "y": 40,
        "width": 20,
        "height": 14
      },
      "action": {
        "type": "dialogue",
        "dialogue": "affaires"
      }
    },
    {
      "id": "fenetre",
      "label": "La fenêtre",
      "button": "La fenêtre",
      "shape": {
        "type": "rect",
        "x": 40,
        "y": 20,
        "width": 20,
        "height": 14
      },
      "action": {
        "type": "dialogue",
        "dialogue": "fenetre"
      }
    },
    {
      "id": "lit",
      "label": "Le lit",
      "button": "Le lit",
      "shape": {
        "type": "rect",
        "x": 70,
        "y": 40,
        "width": 20,
        "height": 14
      },
      "action": {
        "type": "dialogue",
        "dialogue": "lit"
      }
    }
  ],
  "dialogues": {
    "affaires": {
      "lines": [
        {
          "text": "Je range mes quelques affaires. (texte à venir)"
        }
      ]
    },
    "fenetre": {
      "lines": [
        {
          "text": "Je regarde par la fenêtre. (texte à venir)"
        }
      ]
    },
    "lit": {
      "lines": [
        {
          "character": "joueur",
          "text": "« La journée de demain s'annonce intense, je ferais bien d'aller dormir. »",
          "choices": [
            {
              "text": "Dormir",
              "goto": "inter-scene-3-4"
            },
            {
              "text": "Pas tout de suite"
            }
          ]
        }
      ]
    }
  }
}
