{
  "$schema": "../../../schemas/map.schema.json",
  "id": "cour",
  "name": "La cour",
  "background": "assets/backgrounds/cour.svg",
  "regions": [
    {
      "id": "arbre",
      "label": "Le grand arbre",
      "shape": {
        "type": "polygon",
        "points": [
          [15, 70],
          [17, 40],
          [8, 40],
          [22, 8],
          [36, 40],
          [27, 40],
          [29, 70]
        ]
      },
      "action": {
        "type": "dialogue",
        "dialogue": "arbre"
      }
    },
    {
      "id": "banc",
      "label": "Le banc",
      "shape": {
        "type": "rect",
        "x": 45,
        "y": 58,
        "width": 22,
        "height": 12
      },
      "action": {
        "type": "dialogue",
        "dialogue": "banc"
      }
    },
    {
      "id": "max",
      "label": "Max",
      "shape": {
        "type": "polygon",
        "points": [
          [75, 85],
          [77, 40],
          [80, 31],
          [82, 25],
          [84, 31],
          [87, 40],
          [89, 85]
        ]
      },
      "action": {
        "type": "dialogue",
        "dialogue": "max"
      }
    },
    {
      "id": "vers-couloir",
      "label": "Retour au couloir",
      "shape": {
        "type": "rect",
        "x": 0,
        "y": 20,
        "width": 6,
        "height": 70
      },
      "action": {
        "type": "goto",
        "map": "couloir"
      },
      "arrow": "left"
    }
  ],
  "dialogues": {
    "arbre": {
      "lines": [
        {
          "text": "Un vieux chêne. Des initiales sont gravées dans l'écorce."
        }
      ]
    },
    "banc": {
      "lines": [
        {
          "text": "Un banc au soleil. Quelqu'un a oublié un carnet dessus."
        }
      ]
    },
    "max": {
      "lines": [
        {
          "character": "max",
          "text": "Hé, le nouveau ! Tu joues au foot ?",
          "choices": [
            {
              "text": "Carrément.",
              "next": "max-oui"
            },
            {
              "text": "Pas vraiment…",
              "next": "max-non"
            }
          ]
        }
      ]
    },
    "max-oui": {
      "lines": [
        {
          "character": "max",
          "text": "Génial ! Rendez-vous à la pause de midi."
        }
      ]
    },
    "max-non": {
      "lines": [
        {
          "character": "max",
          "text": "Pas grave, on se retrouvera au café alors."
        }
      ]
    }
  }
}
