{
  "$schema": "../../../schemas/map.schema.json",
  "id": "jardin-serre",
  "name": "Jardin : la serre",
  "background": "assets/backgrounds/jardin-serre.jpg",
  "setFlags": ["serre-vue"],
  "regions": [
    {
      "id": "jardiniere",
      "label": "La jardinière",
      "shape": {
        "type": "polygon",
        "points": [
          [66.5, 58],
          [91.5, 58],
          [91, 72],
          [88, 86],
          [70, 86],
          [67, 70]
        ]
      },
      "action": {
        "type": "dialogue",
        "dialogue": "jardiniere"
      }
    },
    {
      "id": "lavande",
      "label": "Lavande somnolente",
      "if": ["mission-ingredients"],
      "ifNot": ["lavande-prise"],
      "shape": {
        "type": "polygon",
        "points": [
          [66.5, 58],
          [91.5, 58],
          [91, 72],
          [88, 86],
          [70, 86],
          [67, 70]
        ]
      },
      "action": {
        "type": "dialogue",
        "dialogue": "lavande"
      }
    },
    {
      "id": "glycine",
      "label": "Essence de glycine concentrée",
      "if": ["mission-ingredients"],
      "ifNot": ["glycine-prise"],
      "shape": {
        "type": "rect",
        "x": 18.5,
        "y": 44.5,
        "width": 11.5,
        "height": 9
      },
      "action": {
        "type": "dialogue",
        "dialogue": "glycine"
      }
    },
    {
      "id": "vers-cours",
      "label": "Aller dans la cour du jardin",
      "shape": {
        "type": "rect",
        "x": 41,
        "y": 10,
        "width": 22,
        "height": 42
      },
      "action": {
        "type": "goto",
        "map": "jardin-cours"
      },
      "arrow": "up"
    },
    {
      "id": "porte-biblio",
      "label": "Retourner à la bibliothèque",
      "button": "Porte",
      "shape": {
        "type": "rect",
        "x": 43,
        "y": 84,
        "width": 14,
        "height": 11
      },
      "action": {
        "type": "goto",
        "map": "bibliotheque"
      }
    }
  ],
  "dialogues": {
    "jardiniere": {
      "lines": [
        {
          "text": "« L'endroit parfait pour faire pousser des herbes magiques. »"
        }
      ]
    },
    "lavande": {
      "setFlags": ["lavande-prise"],
      "lines": [
        {
          "text": "Je cueille quelques brins de lavande somnolente."
        }
      ]
    },
    "glycine": {
      "setFlags": ["glycine-prise"],
      "lines": [
        {
          "text": "Je prends une fiole d'essence de glycine concentrée."
        }
      ]
    }
  }
}
