{
  "$schema": "../../../schemas/map.schema.json",
  "id": "couloir",
  "name": "Le couloir",
  "background": "assets/backgrounds/couloir.svg",
  "regions": [
    {
      "id": "casiers",
      "label": "Les casiers",
      "shape": {
        "type": "rect",
        "x": 20,
        "y": 20,
        "width": 14,
        "height": 50
      },
      "action": {
        "type": "dialogue",
        "dialogue": "casiers"
      }
    },
    {
      "id": "lea",
      "label": "Léa",
      "shape": {
        "type": "polygon",
        "points": [
          [42, 85],
          [44, 40],
          [47, 31],
          [49, 25],
          [51, 31],
          [54, 40],
          [56, 85]
        ]
      },
      "action": {
        "type": "dialogue",
        "dialogue": "lea"
      }
    },
    {
      "id": "porte-cafe",
      "label": "Entrer au café",
      "shape": {
        "type": "rect",
        "x": 60,
        "y": 18,
        "width": 14,
        "height": 52
      },
      "action": {
        "type": "goto",
        "map": "cafe"
      }
    },
    {
      "id": "vers-chambre",
      "label": "Retour à la chambre",
      "shape": {
        "type": "rect",
        "x": 0,
        "y": 20,
        "width": 8,
        "height": 70
      },
      "action": {
        "type": "goto",
        "map": "chambre"
      },
      "arrow": "left"
    },
    {
      "id": "vers-cour",
      "label": "Aller dans la cour",
      "shape": {
        "type": "rect",
        "x": 92,
        "y": 20,
        "width": 8,
        "height": 70
      },
      "action": {
        "type": "goto",
        "map": "cour"
      },
      "arrow": "right"
    }
  ],
  "dialogues": {
    "casiers": {
      "lines": [
        {
          "text": "Des rangées de casiers métalliques. Le tien est le 42."
        }
      ]
    },
    "lea": {
      "lines": [
        {
          "character": "lea",
          "text": "Salut ! Tu es nouveau, non ? Je ne t'ai jamais vu ici."
        },
        {
          "character": "lea",
          "text": "Je m'appelle Léa. Tu veux que je te fasse visiter ?",
          "choices": [
            {
              "text": "Avec plaisir !",
              "next": "lea-oui"
            },
            {
              "text": "Non merci, je me débrouille.",
              "next": "lea-non"
            }
          ]
        }
      ]
    },
    "lea-oui": {
      "lines": [
        {
          "character": "lea",
          "text": "Super ! Commençons par la cour, suis-moi.",
          "choices": [
            {
              "text": "(La suivre)",
              "goto": "cour"
            }
          ]
        }
      ]
    },
    "lea-non": {
      "lines": [
        {
          "character": "lea",
          "text": "Ah… d'accord. À plus tard alors !"
        }
      ]
    }
  }
}
